{
  "schemaVersion": "1.0",
  "generatedAt": "2026-10-01T04:27:22.443901Z",
  "repositoryRoot": "C:\\Users\\shash\\Downloads\\BankManagementSystem-WPF-main\\BankManagementSystem-WPF-main\\",
  "windows": [
    {
      "xaml": "BankManagementSystem/App.xaml",
      "className": "BankManagementSystem.App",
      "events": [],
      "commands": []
    },
    {
      "xaml": "BankManagementSystem/CheckBalanceWindow.xaml",
      "className": "BankManagementSystem.CheckBalanceWindow",
      "events": [
        {
          "attribute": "Height",
          "handler": "650"
        },
        {
          "attribute": "Width",
          "handler": "850"
        },
        {
          "attribute": "WindowStartupLocation",
          "handler": "CenterScreen"
        },
        {
          "attribute": "ResizeMode",
          "handler": "NoResize"
        },
        {
          "attribute": "Width",
          "handler": "500"
        },
        {
          "attribute": "Height",
          "handler": "500"
        },
        {
          "attribute": "Background",
          "handler": "White"
        },
        {
          "attribute": "CornerRadius",
          "handler": "12"
        },
        {
          "attribute": "Padding",
          "handler": "25"
        },
        {
          "attribute": "HorizontalAlignment",
          "handler": "Center"
        },
        {
          "attribute": "VerticalAlignment",
          "handler": "Center"
        },
        {
          "attribute": "FontSize",
          "handler": "36"
        },
        {
          "attribute": "FontWeight",
          "handler": "Bold"
        },
        {
          "attribute": "HorizontalAlignment",
          "handler": "Center"
        },
        {
          "attribute": "FontSize",
          "handler": "18"
        },
        {
          "attribute": "Name",
          "handler": "txtAccountNumber"
        },
        {
          "attribute": "Height",
          "handler": "45"
        },
        {
          "attribute": "FontSize",
          "handler": "18"
        },
        {
          "attribute": "Height",
          "handler": "45"
        },
        {
          "attribute": "FontSize",
          "handler": "18"
        },
        {
          "attribute": "FontWeight",
          "handler": "Bold"
        },
        {
          "attribute": "Foreground",
          "handler": "White"
        },
        {
          "attribute": "Click",
          "handler": "BtnCheckBalance_Click"
        },
        {
          "attribute": "FontSize",
          "handler": "18"
        },
        {
          "attribute": "FontWeight",
          "handler": "Bold"
        },
        {
          "attribute": "Name",
          "handler": "txtName"
        },
        {
          "attribute": "Height",
          "handler": "45"
        },
        {
          "attribute": "FontSize",
          "handler": "18"
        },
        {
          "attribute": "IsReadOnly",
          "handler": "True"
        },
        {
          "attribute": "FontSize",
          "handler": "18"
        },
        {
          "attribute": "FontWeight",
          "handler": "Bold"
        },
        {
          "attribute": "Name",
          "handler": "txtBalance"
        },
        {
          "attribute": "Height",
          "handler": "45"
        },
        {
          "attribute": "FontSize",
          "handler": "18"
        },
        {
          "attribute": "IsReadOnly",
          "handler": "True"
        }
      ],
      "commands": []
    },
    {
      "xaml": "BankManagementSystem/CreateAccountWindow.xaml",
      "className": "BankManagementSystem.CreateAccountWindow",
      "events": [
        {
          "attribute": "Height",
          "handler": "620"
        },
        {
          "attribute": "Width",
          "handler": "450"
        },
        {
          "attribute": "WindowStartupLocation",
          "handler": "CenterScreen"
        },
        {
          "attribute": "ResizeMode",
          "handler": "NoResize"
        },
        {
          "attribute": "Width",
          "handler": "360"
        },
        {
          "attribute": "Background",
          "handler": "White"
        },
        {
          "attribute": "CornerRadius",
          "handler": "10"
        },
        {
          "attribute": "Padding",
          "handler": "15"
        },
        {
          "attribute": "VerticalAlignment",
          "handler": "Center"
        },
        {
          "attribute": "HorizontalAlignment",
          "handler": "Center"
        },
        {
          "attribute": "VerticalScrollBarVisibility",
          "handler": "Auto"
        },
        {
          "attribute": "FontSize",
          "handler": "22"
        },
        {
          "attribute": "FontWeight",
          "handler": "Bold"
        },
        {
          "attribute": "HorizontalAlignment",
          "handler": "Center"
        },
        {
          "attribute": "Name",
          "handler": "cmbAccountType"
        },
        {
          "attribute": "Height",
          "handler": "30"
        },
        {
          "attribute": "Content",
          "handler": "Savings"
        },
        {
          "attribute": "Content",
          "handler": "Current"
        },
        {
          "attribute": "Content",
          "handler": "Salary"
        },
        {
          "attribute": "Name",
          "handler": "txtFirstName"
        },
        {
          "attribute": "Height",
          "handler": "30"
        },
        {
          "attribute": "Name",
          "handler": "txtMiddleName"
        },
        {
          "attribute": "Height",
          "handler": "30"
        },
        {
          "attribute": "Name",
          "handler": "txtLastName"
        },
        {
          "attribute": "Height",
          "handler": "30"
        },
        {
          "attribute": "Name",
          "handler": "dpDOB"
        },
        {
          "attribute": "Height",
          "handler": "30"
        },
        {
          "attribute": "Text",
          "handler": "Gender"
        },
        {
          "attribute": "Name",
          "handler": "cmbGender"
        },
        {
          "attribute": "Height",
          "handler": "30"
        },
        {
          "attribute": "Content",
          "handler": "Male"
        },
        {
          "attribute": "Content",
          "handler": "Female"
        },
        {
          "attribute": "Content",
          "handler": "Other"
        },
        {
          "attribute": "Name",
          "handler": "txtPan"
        },
        {
          "attribute": "Height",
          "handler": "30"
        },
        {
          "attribute": "Name",
          "handler": "txtCurrentAddress"
        },
        {
          "attribute": "Height",
          "handler": "30"
        },
        {
          "attribute": "Name",
          "handler": "txtPermanentAddress"
        },
        {
          "attribute": "Height",
          "handler": "30"
        },
        {
          "attribute": "Name",
          "handler": "txtMobile"
        },
        {
          "attribute": "Height",
          "handler": "30"
        },
        {
          "attribute": "Height",
          "handler": "35"
        },
        {
          "attribute": "Click",
          "handler": "BtnSave_Click"
        },
        {
          "attribute": "Content",
          "handler": "Clear"
        },
        {
          "attribute": "Height",
          "handler": "35"
        },
        {
          "attribute": "Click",
          "handler": "BtnClear_Click"
        }
      ],
      "commands": []
    },
    {
      "xaml": "BankManagementSystem/DashboardWindow.xaml",
      "className": "BankManagementSystem.DashboardWindow",
      "events": [
        {
          "attribute": "Title",
          "handler": "Dashboard"
        },
        {
          "attribute": "Height",
          "handler": "650"
        },
        {
          "attribute": "Width",
          "handler": "900"
        },
        {
          "attribute": "WindowStartupLocation",
          "handler": "CenterScreen"
        },
        {
          "attribute": "ResizeMode",
          "handler": "NoResize"
        },
        {
          "attribute": "Width",
          "handler": "550"
        },
        {
          "attribute": "Background",
          "handler": "White"
        },
        {
          "attribute": "CornerRadius",
          "handler": "15"
        },
        {
          "attribute": "Padding",
          "handler": "25"
        },
        {
          "attribute": "VerticalAlignment",
          "handler": "Center"
        },
        {
          "attribute": "HorizontalAlignment",
          "handler": "Center"
        },
        {
          "attribute": "FontSize",
          "handler": "30"
        },
        {
          "attribute": "FontWeight",
          "handler": "Bold"
        },
        {
          "attribute": "HorizontalAlignment",
          "handler": "Center"
        },
        {
          "attribute": "Name",
          "handler": "BtnCreateAccount"
        },
        {
          "attribute": "Height",
          "handler": "50"
        },
        {
          "attribute": "FontSize",
          "handler": "16"
        },
        {
          "attribute": "Click",
          "handler": "BtnCreateAccount_Click"
        },
        {
          "attribute": "Name",
          "handler": "BtnDeposit"
        },
        {
          "attribute": "Height",
          "handler": "50"
        },
        {
          "attribute": "FontSize",
          "handler": "16"
        },
        {
          "attribute": "Click",
          "handler": "BtnDeposit_Click"
        },
        {
          "attribute": "Name",
          "handler": "BtnWithdraw"
        },
        {
          "attribute": "Height",
          "handler": "50"
        },
        {
          "attribute": "FontSize",
          "handler": "16"
        },
        {